Hades;Roguelike, Экшн, Ролевая игра;Игрок управляет Загреем, сыном Аида, который пытается выбраться из Подземного мира;Roguelike, бои с боссами, улучшение персонажа, сюжет;10+;40000000;Dead Cells - похожая механика roguelike, Bastion - cхожая система повествования
Cuphead;Run-and-gun, Аркада;Игрок сражается с боссами, используя различные виды оружия;Run-and-gun, бои с боссами, мультяшная графика, высокая сложность;10+;2000000;Devil May Cry 5 - похожий экшен, Metal Slug - 2D аналог
Super Mario Odyssey;Платформер, 3D-платформер;Марио путешествует по различным мирам, чтобы спасти принцессу Пич;Платформинг, акробатика, захват врагов;3+;20000000;Super Mario Galaxy - похожая структура уровней, A Hat in Time - cхожая стилистика
The Legend of Zelda: Breath of the Wild;Приключенческая игра, Открытый мир;Линк просыпается после 100-летнего сна и должен спасти королевство Хайрул;Исследование, сражения, головоломки;10+;25000000;Elden Ring - cхожая структура открытого мира, Horizon Zero Dawn - cхожая система боя
Hades;Roguelike, Экшн, Ролевая игра;Загрей, сын Аида, пытается выбраться из Подземного мира;Roguelike, бои с боссами, улучшение персонажа, сюжет;10+;40000000;Dead Cells - похожая механика roguelike, Bastion - cхожая система повествования
Celeste;Платформер, Аркада;Мадлен пытается покорить гору Селеста;Платформинг, элементы RPG, пиксель-арт, трогательная история;10+;5000000;Super Meat Boy - более хардкорный, Fez - с акцентом на разгадывание тайн
Hollow Knight;Metroidvania, Аркада;Игрок исследует огромный мир, сражается с врагами и прокачивает своего персонажа;Metroidvania, платформер, исследование, сражения с боссами;10+;10000000;Ori and the Will of the Wisps - похожий визуальный стиль, Metroid Dread - более классическая Metroidvania
Animal Crossing: New Horizons;Симулятор жизни, Приключение;Игрок переезжает на остров и начинает новую жизнь;Симулятор жизни, crafting, общение с персонажами;3+;35000000;Stardew Valley - cхожая атмосфера, Minecraft - cхожая система crafting
Splatoon 2;Шутер от третьего лица, Мультиплеер;Игрок участвует в командных сражениях с использованием краски;Шутер, командная игра, яркая графика;10+;13000000;Overwatch - cхожая система командных сражений, Fortnite - cхожая популярность
Mario Kart 8 Deluxe;Гонки, Аркада;Игрок участвует в гонках на различных трассах;Гонки, аркадный режим, кастомизация персонажей;3+;40000000;Crash Team Racing Nitro-Fueled - cхожая аркадная механика, Forza Horizon 5 - cхожая реалистичная графика
Fire Emblem: Three Houses;Тактическая RPG, Пошаговая стратегия;Игрок участвует в тактических сражениях и управляет отрядом персонажей;Тактика, RPG, сюжетная линия;13+;3000000;Final Fantasy Tactics - cхожая система боя, Valkyria Chronicles - cхожая стилистика
Luigi's Mansion 3;Стелс, Приключение;Луиджи исследует отель, полный призраков;Стелс, решение головоломок, юмор;10+;10000000;Amnesia: The Dark Descent - cхожая атмосфера страха, Super Mario Sunshine - cхожая система управления
Grand Theft Auto: Vice City;Экшн, Приключение, 3D-платформер;Томми Версетти строит криминальную империю в Vice City;Открытый мир, стрельба, вождение, криминальная тематика;18+;17500000;Mafia: The City of Lost Heaven - cхожая криминальная тематика, Saints Row 2 - cхожая система открытого мира
Max Payne 2: The Fall of Max Payne;Шутер от третьего лица, Нуар;Макс Пэйн мстит за смерть своей семьи;Bullet time, нуарная атмосфера, драматический сюжет;18+;7500000;John Woo Presents Stranglehold - cхожая система bullet time, Kane & Lynch: Dead Men - cхожая атмосфера
Resident Evil 4;Survival horror, Шутер от третьего лица;Леон Кеннеди спасает дочь президента США из рук зомби;Survival horror, стрельба, решение головоломок;18+;9000000;Silent Hill 2 - cхожая атмосфера страха, Dead Space - cхожая система стрельбы
Metal Gear Solid 2: Sons of Liberty;Стелс, Экшн;Солид Снейк проникает на танкер, чтобы остановить террористов;Стелс, тактика, философские темы;18+;6000000;Splinter Cell: Chaos Theory - cхожая система стелса, Deus Ex - cхожая философская направленность
Deus Ex;RPG, Шутер от первого лица;Джей-Си Дентон выполняет задания, используя различные навыки и способности;RPG, шутер, имплантаты, моральные выборы;18+;4000000;System Shock 2 - cхожая стилистика, BioShock - cхожая система моральных выборов
Gothic II;RPG, Открытый мир;Безымянный герой исследует мир Готики, выполняя задания и сражаясь с монстрами;RPG, открытый мир, фэнтезийная атмосфера;16+;3000000;The Elder Scrolls III: Morrowind - cхожая система RPG, World of Warcraft - cхожая система MMORPG
The Elder Scrolls III: Morrowind;RPG, Открытый мир;Нереварин должен остановить Дагот Ура и спасти Морровинд;RPG, открытый мир, фэнтезийная атмосфера;16+;4000000;Gothic II - cхожая система RPG, World of Warcraft - cхожая система MMORPG
Warcraft III: Reign of Chaos;RTS, Фэнтези;Орки и люди сражаются за контроль над Азеротом;RTS, фэнтезийная атмосфера, сюжетная кампания;12+;6000000;StarCraft - cхожая система RTS, Command & Conquer - cхожая RTS классика
StarCraft;RTS, Sci-Fi;Терраны, протоссы и зерги сражаются за контроль над сектором Koprulu;RTS, научно-фантастическая атмосфера, соревновательная игра;12+;11000000;Warcraft III: Reign of Chaos - cхожая система RTS, Command & Conquer - cхожая RTS классика
Counter-Strike 1.6;Шутер от первого лица, Мультиплеер;Террористы и контр-террористы сражаются друг с другом;Шутер, командная игра, соревновательная игра;18+;25000000;Half-Life: Counter-Strike - оригинальная игра, Valorant - cхожая система командных сражений
The Wonderful 101;Экшн, Бит-эм-ап;Игрок управляет группой супергероев, которые должны спасти мир;Бои, командная игра, рисование форм для управления героями;10+;1000000;Bayonetta - cхожая система боя, Astral Chain - cхожая стилистика
Duke Nukem Forever;Шутер от первого лица, Экшн;Дюк Нюкем возвращается, чтобы сразиться с пришельцами;Шутер, черный юмор, сатира;18+;500000;Call of Duty: Modern Warfare - cхожая система стрельбы, Doom - cхожая атмосфера
Mighty No. 9;Платформер, Экшн;Бек, робот-ниндзя, должен остановить злого доктора Уайли;Платформинг, бои с боссами, пиксель-арт;10+;500000;Mega Man - cхожая механика, Shovel Knight - cхожая стилистика
Marvel vs. Capcom: Infinite;Файтинг, Кроссовер;Персонажи Marvel и Capcom сражаются друг с другом;Файтинг, командные сражения, 2D графика;10+;2000000;Super Smash Bros. Ultimate - cхожая механика, Dragon Ball FighterZ - cхожая система комбо
Sonic Boom: Rise of Lyric;Платформер, 3D-платформер;Соник и его друзья должны остановить Лирика, который хочет захватить мир;Платформинг, бои с боссами, 3D графика;3+;1000000;Super Mario Odyssey - cхожая структура уровней, Crash Bandicoot N. Sane Trilogy - cхожая стилистика
Final Fantasy VII Remake;JRPG, Экшн, Ролевая игра;Классическая JRPG Final Fantasy VII в современной 3D-оболочке;JRPG, бои в реальном времени, сюжетная линия;16+;5000000;Kingdom Hearts III - cхожая система боя, Dragon Quest XI - cхожая стилистика JRPG
Ghost of Tsushima;Боевик-приключение, Приключение;Самурай Дзин Sakai сражается с монгольскими захватчиками;Открытый мир, стелс, сражения на мечах;18+;6000000;Assassin's Creed Valhalla - cхожая система открытого мира, Sekiro: Shadows Die Twice - cхожая система боя
The Last of Us Part II;Приключенческая игра, Стелс, Выживание;Элли ищет мести за смерть Джоэла;Стелс, экшен, сюжетная линия;18+;4000000;Uncharted 4: A Thief's End - cхожая система стелса, God of War (2018) - cхожая система экшена
Cyberpunk 2077;RPG, Шутер от первого лица, Открытый мир;V наемник в футуристическом Найт-Сити;RPG, шутер, открытый мир, сюжетная линия;18+;30000000;Fallout 4 - cхожая система RPG, Deus Ex: Human Revolution - cхожая стилистика киберпанка
Among Us;Мультиплеер, Социальная дедукция;Игроки должны вычислить предателей среди членов экипажа;Мультиплеер, детектив, юмор;10+;20000000;Town of Salem - cхожая система дедукции, Fall Guys: Ultimate Knockout - cхожая популярность
Fall Guys: Ultimate Knockout;Мультиплеер, Аркада;Игроки участвуют в забавных конкурсах;Мультиплеер, аркадный режим, юмор;3+;20000000;Mario Party - cхожая система мини-игр, Overcooked 2 - cхожая кооперативная механика
Valorant;Тактический шутер, Мультиплеер;Игроки участвуют в командных сражениях с использованием уникальных персонажей;Тактический шутер, командная игра, разнообразие персонажей;13+;15000000;Counter-Strike: Global Offensive - cхожая система стрельбы, Overwatch - cхожая система героев
Genshin Impact;RPG, Открытый мир, Гача;Игрок исследует огромный мир, сражается с врагами и прокачивает своих персонажей;RPG, gacha, открытый мир, аниме-стилистика;10+;3000000;The Legend of Zelda: Breath of the Wild - cхожая система открытого мира, Ni no Kuni: Wrath of the White Witch - cхожая стилистика JRPG
Phasmophobia;Хоррор, Стелс, Выживание;Игроки исследуют паранормальные места, чтобы найти и identify ghosts;Стелс, кооперативная игра, расследование;13+;5000000;Amnesia: The Dark Descent - cхожая атмосфера страха, Dead by Daylight - cхожая система кооперативной игры
Crusader Kings III;Гранд-стратегия, Симулятор;Игроки управляют династией в средневековой Европе;Стратегия, управление, ролевая игра;13+;2000000;Europa Universalis IV - cхожая сложность, Stellaris - cхожая система исследования
Ori and the Will of the Wisps;Metroidvania, Платформер;Игроки исследуют красивый и опасный мир, сражаются с врагами и решают головоломки;Metroidvania, платформер, красочная графика, трогательная история;10+;5000000;Hollow Knight - cхожая механика Metroidvania, Celeste - cхожая сложность
Half-Life: Alyx;Шутер от первого лица, VR;Игроки сражаются с Combine в виртуальной реальности;Шутер, VR, сюжетная линия;13+;3000000;Boneworks - cхожая механика VR, Superhot VR - cхожая динамика
Nioh 2;Soulslike, Экшн-RPG;Игроки сражаются с демонами в феодальной Японии;Soulslike, сложные бои, система лута, RPG-элементы;18+;2000000;Dark Souls 3 - cхожая сложность, Sekiro: Shadows Die Twice - cхожая система боя
Yakuza: Like a Dragon;JRPG, Пошаговая стратегия;Игроки управляют Ichiban Kasuga, который yakuza;JRPG, пошаговая стратегия, юмор, криминальная драма;18+;5000000;Persona 5 Royal - cхожая стилистика JRPG, Final Fantasy VII Remake - cхожая система боя
Demon’s Souls (2020);Soulslike, Экшн-RPG;Игроки сражаются с демонами в фэнтезийном мире;Soulslike, сложные бои, система лута, RPG-элементы;18+;3000000;Dark Souls 3 - cхожая сложность, Bloodborne - cхожая готическая атмосфера
Sackboy: A Big Adventure;Платформер, 3D-платформер;Sackboy embarks on an adventure;Платформинг, кооперативная игра, красочный мир;3+;5000000;Super Mario Odyssey - cхожая стилистика, Kirby and the Forgotten Land - cхожая механика
Immortals Fenyx Rising;Приключенческая игра, Открытый мир;Игроки explore a Greek mythology-inspired world;Открытый мир, сражения, головоломки, элементы RPG;10+;5000000;The Legend of Zelda: Breath of the Wild - cхожая структура
Binary Domain;Шутер от третьего лица, Экшн;Отряд солдат сражается с роботами в футуристичном Токио;Шутер, командная игра, элементы RPG;16+;1000000;Gears of War - cхожая система боя, Mass Effect - cхожая система RPG
Kingdoms of Amalur: Reckoning;Ролевая игра, Экшн, Открытый мир;Игрок исследует фэнтезийный мир и сражается с врагами;RPG, бои в реальном времени, открытый мир;16+;3000000;Skyrim - cхожая система RPG, Dragon Age: Inquisition - cхожая структура открытого мира
Sleeping Dogs;Экшн, Приключение, Открытый мир;Полицейский под прикрытием внедряется в гонконгскую мафию;Бои в реальном времени, стелс, вождение;18+;5000000;Grand Theft Auto V - cхожая структура открытого мира, Yakuza 0 - cхожая стилистика
Darksiders II;Экшн, Приключение, Hack and slash;Война, один из Всадников Апокалипсиса, мстит за своего брата;Hack and slash, платформер, элементы RPG;16+;2000000;God of War - cхожая система боя, Dante's Inferno - cхожая стилистика
The Darkness II;Шутер от первого лица, Экшн, Сверхъестественное;Гангстер, одержимый демоном, использует свои силы для мести;Шутер, элементы хоррора, суперспособности;18+;1000000;FEAR - cхожая атмосфера страха, BioShock - cхожая система использования суперспособностей
Syndicate;Шутер от первого лица, Киберпанк;Хакер сражается с мегакорпорациями в футуристическом мире;Шутер, элементы RPG, стелс;18+;1000000;Deus Ex: Human Revolution - cхожая стилистика киберпанка, Cyberpunk 2077 - cхожая система RPG
Dragon’s Dogma;Ролевая игра, Экшн, Открытый мир;Игрок сражается с монстрами и исследует фэнтезийный мир;RPG, бои в реальном времени, открытый мир;16+;5000000;Skyrim - cхожая система RPG, Dark Souls - cхожая сложность
ZombiU;Шутер от первого лица, Выживание, Хоррор;Игрок выживает в Лондоне, полном зомби;Шутер, survival horror, ограниченные ресурсы;18+;1000000;Resident Evil 4 - cхожая система боя, Dead Space - cхожая атмосфера страха
Far Cry 3: Blood Dragon;Шутер от первого лица, Экшн, Открытый мир;"Рекс ""Кровавый Дракон"" Кольт сражается с киборгами на тропическом острове";Шутер, открытый мир, 80-е;18+;2000000;Far Cry 3 - cхожая система боя, Hotline Miami - cхожая стилистика
