Название игры;Жанры;Краткое описание игры;Основные игровые механики и элементы;Целевая аудитория игры;Потенциальная прибыльность игры;Конкуренты и анализ их игровых особенностей
Microsoft Flight Simulator;Симулятор, Экшн;Реалистичный симулятор полётов на различных самолётах;Управление самолётом, изучение реальных локаций, выполнение заданий;10+;100000000;X-Plane 11 - более комплексный симулятор, Aerofly FS 2 - более простой и доступный
Euro Truck Simulator 2;Симулятор, Стратегия;Симулятор дальнобойщика, в котором нужно перевозить грузы по Европе;Управление грузовиком, планирование маршрутов, развитие компании;13+;50000000;American Truck Simulator - аналог в США, Train Simulator - симулятор поезда
Farming Simulator 22;Симулятор, Стратегия;Симулятор фермера, в котором нужно управлять фермой и зарабатывать деньги;Управление сельскохозяйственной техникой, выращивание crops, разведение животных;10+;30000000;Landwirtschafts-Simulator 22 - аналог, Plant Tycoon - симулятор управления садом
The Sims 4;Симулятор, Стратегия;Симулятор жизни, в котором нужно создавать и управлять персонажами;Создание персонажей, строительство домов, управление жизнью симов;13+;200000000;Animal Crossing: New Horizons - симулятор жизни на острове, Second Life - виртуальный мир
Cities: Skylines;Симулятор, Стратегия;Симулятор градостроительства, в котором нужно построить и развивать город;Градостроительство, управление ресурсами, решение проблем;13+;80000000;SimCity 4 - классический симулятор градостроительства, Anno 1800 - симулятор развития с упором на экономику
Surgeon Simulator 2;Симулятор, Экшн;Комичный симулятор хирурга, в котором нужно проводить операции;Управление инструментами, проведение операций, юмор;16+;20000000;Goat Simulator - симулятор козла, Surgeon Simulator - более реалистичный симулятор хирурга
Viscera Cleanup Detail;Симулятор, Экшн;Симулятор уборщика на космической станции после сражения с монстрами;Уборка крови, расчлененных тел, использование различных инструментов;16+;10000000;House Flipper - симулятор ремонта, PowerWash Simulator - симулятор мойки
Pizza Simulator;Симулятор, Стратегия;Симулятор пиццерии, в котором нужно готовить пиццу и обслуживать клиентов;Приготовление пиццы, управление персоналом, развитие бизнеса;10+;5000000;Cooking Simulator - симулятор приготовления различных блюд, Overcooked 2 - симулятор
Devil May Cry 5;Экшн, Слэшер;Стильный экшн с динамичными сражениями и комбо-системой;Слэшер, бои с боссами, акробатика, прокачка персонажа;16+;60000000;Bayonetta - похожая стилистика, Metal Gear Rising: Revengeance - cхожая система parry
Doom Eternal;Шутер от первого лица, Экшн;Жестокий шутер от первого лица с демонами;Шутер от первого лица, сражения с боссами, арсенал оружия, gore;18+;100000000;Wolfenstein II: The New Colossus - шутер от первого лица в альтернативной истории, Shadow Warrior 3 - cхожая система gore
Sekiro: Shadows Die Twice;Экшн, Ролевая игра;Самурайский экшн с акцентом на парирование и stealth;Бои с мечами, стелс, прокачка персонажа, сюжет;16+;50000000;Ghost of Tsushima - похожая сетка самураев, Star Wars Jedi: Fallen Order - cхожая система парирования
Elden Ring;Экшн, Ролевая игра;Open-world RPG с challenging combat and exploration;Бои с мечами, магия, открытый мир, прокачка персонажа;16+;30000000;The Legend of Zelda: Breath of the Wild - похожий open-world, Dark Souls 3 - cхожая сложность
Monster Hunter Rise;Экшн, Ролевая игра;Игрок охотится на монстров, используя различные виды оружия и брони;Охота на монстров, крафт, кооператив, прокачка персонажа;13+;30000000;Dauntless - бесплатный аналог, God Eater 3 - cхожая система охоты
Deathloop;Экшн, Приключение;Игрок застрял во временной петле и должен убить 8 Visionaries;Стелс, экшн, временная петля, арсенал оружия;18+;80000000;Dishonored - похожая система стелс, Hitman - cхожая система убийств
Hitman 3;Стелс, Экшн;Игрок управляет Агентом 47, который должен выполнять заказные убийства;Стелс, убийства, контракты, открытый мир;18+;20000000;Dishonored - похожая система стелс, Assassin's Creed Valhalla - cхожая система open-world
The Last of Us;Приключение, Боевик-приключение;Постапокалиптическое приключение о Джоэле и Элли;Стелс, экшн, крафт, сюжет;18+;10000000;Uncharted 4: A Thief's End - похожая история и персонажи, God of War - cхожая система боя
Uncharted 4: A Thief's End;Приключение, Боевик-приключение;Приключенческий экшн о Нейтане Дрейке и его поисках сокровищ;Платформинг, перестрелки, головоломки, сюжет;16+;5000000;The Last of Us - более реалистичная история, Tomb Raider - cхожая система поиска сокровищ
God of War;Приключение, Боевик-приключение;Приключение Кратоса и его сына Атрея в мире скандинавской мифологии;Бои с боссами, крафт, сюжет, исследование;18+;40000000;The Last of Us - похожая система боя, Hellblade: Senua's Sacrifice - cхожая мрачная атмосфера
Red Dead Redemption 2;Приключение, Боевик-приключение;Приключение Артура Моргана на Диком Западе;Открытый мир, стрельба, лошади, сюжет;18+;60000000;Grand Theft Auto V - похожий open-world, The Witcher 3: Wild Hunt - cхожая система моральных выборов
The Witcher 3: Wild Hunt;Приключение, Ролевая игра;Фэнтезийная RPG о Геральте из Ривии, охотнике на монстров;Ролевая система, открытый мир, монстры, сюжет;18+;100000000;Skyrim - похожая фэнтезийная вселенная, Dragon Age: Inquisition - cхожая система диалогов
Horizon Zero Dawn;Приключение, Ролевая игра;Приключение Элой в мире, где доминируют роботы;Открытый мир, стрельба из лука, роботы, сюжет;13+;30000000;Assassin's Creed Odyssey - похожий open-world, Far Cry 5 - cхожая система стрельбы
Assassin's Creed Valhalla;Приключение, Ролевая игра;Приключение Эйвора в эпоху викингов;Открытый мир, стелс, сражения, vikings;18+;200000000;Red Dead Redemption 2 - похожий open-world, Ghost of Tsushima - cхожая система сражений
Stardew Valley;Симулятор фермера, Аркада;Игрок переезжает в деревню и начинает новую жизнь, занимаясь фермерством;Симулятор фермера, RPG, открытый мир, расслабляющая атмосфера;10+;30000000;Harvest Moon - классический симулятор фермера, Terraria - более focused на крафт
Cuphead;Run-and-gun, Аркада;Игрок сражается с боссами, используя различные виды оружия;Run-and-gun, бои с боссами, мультяшная графика, высокая сложность;10+;20000000;Devil May Cry 5 - похожий экшен, Metal Slug - 2D аналог
Undertale;Ролевая игра, Аркада;Игрок попадает в Подземелье и должен найти выход;Ролевая система, пошаговые бои, юмор, моральные выборы;10+;10000000;Deltarune - продолжение игры, Earthbound - cхожая атмосфера
Gris;Платформер, Аркада;Игрок управляет девочкой, которая путешествует по красочному миру;Платформинг, арт, эмоции, отсутствие текста;6+;5000000;Journey - похожая атмосфера, Monument Valley - cхожие визуальные эффекты
Baba Is You;Логическая головоломка, Аркада;Игрок должен менять правила игры, чтобы пройти уровень;Логическая головоломка, минималистичный стиль, оригинальная механика;10+;5000000;The Witness - похожая сложность, Portal - cхожая система порталов
Disco Elysium;RPG, Аркада;Игрок расследует убийство, используя различные навыки и способности;RPG, детектив, изометрическая проекция, глубокий текст;18+;10000000;Planescape: Torment - похожая текстовая RPG, Fallout: New Vegas - cхожая свобода выбора
Rust;Выживание, Симулятор;Игрок должен выжить в суровом мире, добывая ресурсы и строя убежище;Выживание, крафт, PvP, строительство;16+;100000000;DayZ - более реалистичное выживание, Ark: Survival Evolved - cхожая система крафта
DayZ;Выживание, Шутер;Игрок должен выжить в постапокалиптическом мире, полном зомби;Выживание, PvP, PvE, зомби;16+;50000000;Escape from Tarkov - более хардкорное выживание, PUBG - cхожая система PvP
Ark: Survival Evolved;Выживание, Приключение;Игрок должен выжить на острове, населенном динозаврами;Выживание, крафт, PvE, динозавры;16+;60000000;Conan Exiles - cхожая система строительства, Rust - более PvP-ориентированная
Subnautica;Выживание, Приключение;Игрок исследует подводный мир инопланетной планеты;Выживание, крафт, PvE, подводный мир;10+;30000000;The Witness - похожая система исследования, No Man's Sky - cхожая sci-fi тематика
The Long Dark;Выживание, Приключение;Игрок должен выжить в условиях канадской зимы;Выживание, исследование, история, одиночество;16+;10000000;Firewatch - похожая атмосфера, Gone Home - cхожая структура повествования
Don't Starve;Выживание, Приключение;Игрок должен выжить в темном и жутком мире;Выживание, крафт, PvE, готическая атмосфера;13+;20000000;Terraria - 2D аналог, This War of Mine - cхожая мрачная атмосфера
Green Hell;Выживание, Симулятор;Игрок должен выжить в амазонских джунглях;Выживание, крафт, PvE, реалистичная симуляция;18+;10000000;The Forest - cхожая система строительства, Rust - более PvP-ориентированная
The Forest;Выживание, Приключение;Игрок должен выжить на острове, населенном каннибалами;Выживание, крафт, PvE, каннибалы;18+;20000000;Sons of the Forest - продолжение игры, Green Hell - cхожая система симуляции
State of Decay 2;Выживание, Стратегия;Игрок управляет группой людей, которые пытаются выжить в зомби-апокалипсисе;Выживание, строительство, управление ресурсами, зомби;16+;30000000;Fallout 4 - cхожая система строительства, 7 Days to Die - cхожая система зомби
Portal;Головоломка, Приключение;Игрок использует порталы, чтобы пройти тестовые камеры;Головоломки с порталами, юмор, научно-фантастическая атмосфера;10+;10000000;Half-Life - cхожая вселенная, The Witness - cхожая сложность
The Witness;Головоломка, Приключение;Игрок исследует остров, полный головоломок;Головоломки, открытый мир, тайна;10+;20000000;Portal - cхожая система порталов, Myst - cхожая атмосфера таинственности
Tetris;Головоломка, Аркада;Игрок должен складывать падающие фигуры;Пазлы, классическая игра, простота;3+;100000000;Puyo Puyo Tetris - вариация с новыми механиками, Lumines - cхожая визуальная стилистика
The Talos Principle;Головоломка, Приключение;Игрок решает головоломки, чтобы пройти испытания древней цивилизации;Головоломки, философские темы, красивый визуальный стиль;13+;10000000;Portal - cхожая система порталов, The Witness - cхожая сложность
The Stanley Parable;Интерактивное кино, Головоломка;Игрок управляет Стэнли, который должен пройти игру, но у него есть выбор;Интерактивное кино, юмор, мета-комментарий;13+;5000000;Undertale - cхожая система выбора, Gone Home - cхожая структура повествования
Superliminal;Головоломка, Приключение;Игрок использует оптические иллюзии, чтобы пройти уровень;Головоломки, перспектива, психоделическая атмосфера;10+;5000000;Portal - cхожая система порталов, The Witness - cхожая сложность
Monument Valley;Головоломка, Приключение;Игрок манипулирует архитектурой, чтобы помочь принцессе пройти уровень;Головоломки, минималистичный стиль, Escher-inspired visuals;3+;10000000;Fez - cхожая визуальная стилистика, The Witness - cхожая сложность
Stephen's Sausage Roll;Головоломка, Аркада;Игрок управляет сосиской, которая должна пройти уровень;Головоломка, физика, юмор;10+;5000000;QWOP - cхожая физика, Getting Over It with Bennett Foddy - cхожая сложность
Amnesia: The Dark Descent;Хоррор, Стелс;Игрок должен выжить в замке, населенном монстрами;Стелс, монстры, атмосфера страха, amnesia;18+;10000000;Outlast - cхожая система стелс, Silent Hill 2 - cхожая атмосфера
Outlast;Хоррор, Стелс;Игрок должен выжить в психиатрической больнице, используя камеру ночного видения;Стелс, монстры, атмосфера ужаса, found footage;18+;10000000;Amnesia: The Dark Descent - cхожая система стелс, Silent Hill P.T. - cхожая атмосфера
Silent Hill 2;Хоррор, Психоделический;Игрок ищет свою жену в потустороннем мире Silent Hill;Психоделический хоррор, монстры, символизм, глубокий сюжет;18+;10000000;Amnesia: The Dark Descent - cхожая атмосфера страха, P.T. - cхожая психоделическая атмосфера
Resident Evil 7: Biohazard;Хоррор, Шутер от первого лица;Игрок должен выжить в доме, кишащем зомби;Шутер от первого лица, зомби, атмосфера страха, survival horror;18+;40000000;Dead Space - cхожая система survival horror, Outlast - cхожая атмосфера ужаса
Dead Space;Хоррор, Шутер от третьего лица;Игрок должен выжить на космическом корабле, зараженном некроморфами;Шутер от третьего лица, некроморфы, атмосфера ужаса, survival horror;18+;20000000;Resident Evil 7: Biohazard - cхожая система survival horror, Alien: Isolation - cхожая атмосфера
Alien: Isolation;Хоррор, Стелс;Игрок должен выжить на космической станции, преследуемый Чужим;Стелс, Чужой, атмосфера ужаса, survival horror;18+;20000000;Outlast - cхожая система стелс, Amnesia: The Dark Descent - cхожая атмосфера страха
P.T.;Хоррор, Психоделический;Игрок заперт в коридоре, где происходят странные события;Психоделический хоррор, атмосфера ужаса, интерактивный тизер;18+;5000000;Silent Hill 2 - cхожая психоделическая атмосфера, Amnesia: The Dark Descent - cхожая атмосфера страха
Heavy Rain;Интерактивное кино, Приключение;Игрок расследует серийного убийцу, используя различные персонажи;QTE, выбор истории, мрачная атмосфера;18+;10000000;Detroit: Become Human - cхожая система QTE, Life is Strange - cхожая структура повествования
Detroit: Become Human;Интерактивное кино, Приключение;Игрок управляет тремя андроидами, которые борются за свободу;QTE, выбор истории, научно-фантастическая атмосфера;16+;30000000;Heavy Rain - cхожая система QTE, Beyond: Two Souls - cхожая вселенная
Beyond: Two Souls;Интерактивное кино, Приключение;Игрок управляет Джоди, которая обладает сверхъестественными силами;QTE, выбор истории, сверхъестественная тема;16+;20000000;Heavy Rain - cхожая система QTE, Detroit: Become Human - cхожая вселенная
Life is Strange;Интерактивное кино, Приключение;Игрок управляет Макс, которая может отматывать время;QTE, выбор истории, coming-of-age история;16+;20000000;Telltale's The Walking Dead - cхожая система выбора, Oxenfree - cхожая атмосфера
Telltale's The Walking Dead;Интерактивное кино, Приключение;Игрок управляет Ли, который пытается выжить в зомби-апокалипсисе;QTE, выбор истории, зомби-тематика;17+;30000000;The Wolf Among Us - cхожая система QTE, Game of Thrones - cхожая структура повествования
The Wolf Among Us;Интерактивное кино, Приключение;Игрок управляет Бигби Вольфом, который расследует преступления в Fabletown;QTE, выбор истории, noir атмосфера;17+;20000000;Telltale's The Walking Dead - cхожая система QTE, Batman: The Telltale Series - cхожая вселенная
Oxenfree;Интерактивное кино, Приключение;Игрок управляет Алексом, который со своими друзьями попадает на мистический остров;QTE, выбор истории, сверхъестественная тема;13+;5000000;Life is Strange - cхожая система выбора, Gone Home - cхожая атмосфера
Gone Home;Интерактивное кино, Приключение;Игрок исследует дом своей семьи, чтобы узнать, что произошло;Исследование, выбор истории, семейная драма;13+;5000000;The Stanley Parable - cхожая структура повествования, Virginia - cхожая атмосфера
Virginia;Интерактивное кино, Приключение;Игрок investigates a missing boy in a surreal world;QTE, exploration, mystery;13+;5000000;Gone Home - cхожая структура повествования, Oxenfree - cхожая атмосфера
Yoshi's Crafted World;Платформер, Приключение;Йоши путешествует по миру, сделанному из различных материалов;Платформинг, милый дизайн, расслабляющая атмосфера;3+;30000000;Kirby and the Forgotten Land - cхожая механика платформинга, Super Mario Odyssey - cхожая красочная атмосфера
Kirby and the Forgotten Land;Платформер, 3D-платформер;Кирби путешествует по 3D-миру, используя различные способности;Платформинг, 3D-мир, милый дизайн;3+;20000000;Super Mario Odyssey - cхожая механика захвата, Yoshi's Crafted World - cхожая стилистика
Minecraft;Песочница, Выживание, Креатив;Игрок может строить и исследовать бесконечный мир;Строительство, крафт, исследование, свобода действий;6+;200000000;Terraria - 2D аналог, Roblox - cхожая платформа для создания игр
Terraria;2D-песочница, Приключение;Игрок исследует 2D-мир, сражается с монстрами и строит различные сооружения;2D-платформинг, крафт, исследование, сражения;6+;50000000;Minecraft - 3D аналог, Starbound - cхожая 2D-песочница
Pok?mon Legends: Arceus;Ролевая игра, Приключение;Игрок исследует мир покемонов и ловит их;RPG-система, покемоны, открытый мир;7+;40000000;Pok?mon Sword and Shield - cхожая система RPG, Monster Hunter Rise - cхожая система исследования
